"correlation_high"	"Transcript_ID"	"Locus_ID"	"Description"	"RAP.DB.Gene.Symbol.Synonym.s."	"RAP.DB.Gene.Name.Synonym.s."	"CGSNL.Gene.Symbol"	"CGSNL.Gene.Name"	"Oryzabase.Gene.Symbol.Synonym.s."	"Oryzabase.Gene.Name.Synonym.s."	"GO"	"InterPro"	"Transcript.evidence"	"ORF.evidence"	"Curation.Date"	"Literature.PMID"	"FLcDNA.clone.ID"	"Oryzabase.Trait.Gene.ID"	"A.thaliana_gene_id"	"Reciprocal_flag"	"Type"	"Short_description"	"Curator_summary"	"Computational_description"	"gene.alias"	"Note"	"symbol"	"Alias"	"full_name"	"computational_description"	"Dbxref"	"locus_type"	"curator_summary"	"description"	"nochangenat.description"	"NormalizationGroup"
-0.52	"Os03t0808300-01"	"Os03g0808300"	"Remorin, C-terminal region domain containing protein."	"-"	"-"	"REM4.2"	"REMORIN 4.2"	"OsREM4.2"	"Remorin 4.2, remorin group 4 member 2"	"-"	"Remorin, C-terminal (IPR005516)"	"AK109389 (DDBJ, Best hit)"	"NP_001152428.1 (RefSeq)"	"-"	"-"	"006-211-F02"	"20273"	"AT3G57540.1"	"2"	"protein_coding"	"Remorin family protein"	"NULL"	"\"Remorin family protein; CONTAINS InterPro DOMAIN/s: Remorin, C-terminal (InterPro:IPR005516); BEST Arabidopsis thaliana protein match is: Remorin family protein (TAIR:AT2G41870.1)\""	"\"AtREM4.1,REM4.1\""	"Remorin family protein"	"-"	"\"AtREM4.1,REM4.1,remorin group 4 1\""	"-"	"Remorin family protein%3B CONTAINS InterPro DOMAIN/s: Remorin%2C C-terminal (InterPro:IPR005516)%3B BEST Arabidopsis thaliana protein match is: Remorin family protein (TAIR:AT2G41870.1)%3B Has 443 Blast hits to 443 proteins in 21 species: Archae - 0%3B Bacteria - 0%3B Metazoa - 1%3B Fungi - 1%3B Plants - 440%3B Viruses - 0%3B Other Eukaryotes - 1 (source: NCBI BLink)."	"\"PMID:15047901,PMID:25289013,locus:2103508\""	"protein_coding"	"-"	"-"	"-"	"data"
-0.52	"Os01t0880200-02"	"Os01g0880200"	"Similar to secondary cell wall-related glycosyltransferase family 8."	"-"	"-"	"-"	"-"	"-"	"-"	"Molecular Function: transferase activity, transferring glycosyl groups (GO:0016757)"	"Glycosyl transferase, family 8 (IPR002495)"	"AK067519 (DDBJ, Best hit)"	"B6UDC6 (UniProt)"	"-"	"-"	"J013112C08"	"-"	"AT1G77130.1"	"1"	"protein_coding"	"plant glycogenin-like starch initiation protein 2"	"Encodes a glucuronyltransferase responsible  for the addition of GlcA residues onto xylan and for secondary wall deposition."	"\"plant glycogenin-like starch initiation protein 2 (PGSIP2); CONTAINS InterPro DOMAIN/s: Glycosyl transferase, family 8 (InterPro:IPR002495); BEST Arabidopsis thaliana protein match is: plant glycogenin-like starch initiation protein 1 (TAIR:AT3G18660.3)\""	"\"GUX3,PGSIP2\""	"plant glycogenin-like starch initiation protein 2"	"PGSIP2"	"\"GUX3,glucuronic acid substitution of xylan 3\""	"plant glycogenin-like starch initiation protein 2"	"plant glycogenin-like starch initiation protein 2 (PGSIP2)%3B CONTAINS InterPro DOMAIN/s: Glycosyl transferase%2C family 8 (InterPro:IPR002495)%3B BEST Arabidopsis thaliana protein match is: plant glycogenin-like starch initiation protein 1 (TAIR:AT3G18660.3)%3B Has 1471 Blast hits to 1463 proteins in 343 species: Archae - 0%3B Bacteria - 240%3B Metazoa - 259%3B Fungi - 287%3B Plants - 508%3B Viruses - 75%3B Other Eukaryotes - 102 (source: NCBI BLink)."	"\"PMID:20852069,PMID:22537759,PMID:22706449,PMID:23373848,locus:2196020\""	"protein_coding"	"Encodes a glucuronyltransferase responsible  for the addition of GlcA residues onto xylan and for secondary wall deposition."	"-"	"-"	"data"
-0.52	"Os02t0810300-01"	"Os02g0810300"	"Similar to NBD-like protein."	"-"	"-"	"ABCI14"	"ABC TRANSPORTER I FAMILY MEMBER 14"	"OsABCI14"	"ABC transporter superfamily ABCI subgroup member 14"	"Molecular Function: nucleotide binding (GO:0000166), Molecular Function: ATP binding (GO:0005524), Molecular Function: ATPase activity (GO:0016887), Molecular Function: nucleoside-triphosphatase activity (GO:0017111)"	"ABC transporter-like (IPR003439), ATPase, AAA+ type, core (IPR003593)"	"AK059363 (DDBJ, Best hit), AK099203 (DDBJ, Best hit)"	"NP_001149302.1 (RefSeq)"	"-"	"-"	"001-026-E03, J023118L21"	"12037"	"AT5G44110.4"	"2"	"protein_coding"	"P-loop containing nucleoside triphosphate hydrolases superfamily protein"	"Encodes a member of the NAP subfamily of ABC transporters."	"\"POP1; CONTAINS InterPro DOMAIN/s: ATPase, AAA+ type, core (InterPro:IPR003593), ABC transporter-like (InterPro:IPR003439); BEST Arabidopsis thaliana protein match is: P-loop containing nucleoside triphosphate hydrolases superfamily protein (TAIR:AT1G03905.1)\""	"\"ABCI21,ATNAP2,ATPOP1,POP1\""	"P-loop containing nucleoside triphosphate hydrolases superfamily protein"	"ABCI21"	"\"ATNAP2,ARABIDOPSIS THALIANA NON-INTRINSIC ABC PROTEIN,ATPOP1,POP1\""	"ATP-binding cassette A21"	"POP1%3B CONTAINS InterPro DOMAIN/s: ATPase%2C AAA+ type%2C core (InterPro:IPR003593)%2C ABC transporter-like (InterPro:IPR003439)%3B BEST Arabidopsis thaliana protein match is: P-loop containing nucleoside triphosphate hydrolases superfamily protein (TAIR:AT1G03905.1)%3B Has 1807 Blast hits to 1807 proteins in 277 species: Archae - 0%3B Bacteria - 0%3B Metazoa - 736%3B Fungi - 347%3B Plants - 385%3B Viruses - 0%3B Other Eukaryotes - 339 (source: NCBI BLink)."	"\"PMID:11346655,PMID:12481097,PMID:15381434,PMID:16307366,PMID:16330762,PMID:16829591,PMID:17076805,PMID:17337630,PMID:18299247,PMID:18650403,PMID:18757557,locus:2167644\""	"protein_coding"	"Encodes a member of the NAP subfamily of ABC transporters."	"-"	"-"	"data"
-0.52	"Os06t0678200-01"	"Os06g0678200"	"Similar to Geranyl diphosphate synthase."	"-"	"-"	"-"	"-"	"OsSPS1, SPS1"	"solanesyl diphosphate synthase 1"	"Biological Process: isoprenoid biosynthetic process (GO:0008299)"	"Polyprenyl synthetase (IPR000092), Terpenoid synthase (IPR008949), Polyprenyl synthetase-related (IPR017446)"	"AK071299 (DDBJ, Best hit), AK059456 (DDBJ, Best hit)"	"B6TA22 (UniProt)"	"-"	"-"	"J023088H10, 001-028-C04"	"11196"	"AT2G34630.2"	"2"	"protein_coding"	"geranyl diphosphate synthase 1"	"Encodes a geranyl diphosphate synthase. RNAi lines are dwarf. T-DNA knock-out lines are embryo lethal."	"\"geranyl diphosphate synthase 1 (GPS1); CONTAINS InterPro DOMAIN/s: Polyprenyl synthetase-related (InterPro:IPR017446), Terpenoid synthase (InterPro:IPR008949), Polyprenyl synthetase (InterPro:IPR000092); BEST Arabidopsis thaliana protein match is: solanesyl diphosphate synthase 2 (TAIR:AT1G17050.1)\""	"\"GPPS,GPS1\""	"geranyl diphosphate synthase 1"	"GPS1"	"\"GPPS,GERANYLPYROPHOSPHATE SYNTHASE\""	"geranyl diphosphate synthase 1"	"geranyl diphosphate synthase 1 (GPS1)%3B CONTAINS InterPro DOMAIN/s: Polyprenyl synthetase-related (InterPro:IPR017446)%2C Terpenoid synthase (InterPro:IPR008949)%2C Polyprenyl synthetase (InterPro:IPR000092)%3B BEST Arabidopsis thaliana protein match is: solanesyl diphosphate synthase 2 (TAIR:AT1G17050.1)%3B Has 15732 Blast hits to 15728 proteins in 2900 species: Archae - 335%3B Bacteria - 9322%3B Metazoa - 401%3B Fungi - 471%3B Plants - 404%3B Viruses - 0%3B Other Eukaryotes - 4799 (source: NCBI BLink)."	"\"PMID:11069698,PMID:12777052,PMID:15653808,PMID:17877699,PMID:18650403,PMID:21220764,PMID:21950843,locus:2062315\""	"protein_coding"	"Encodes a geranyl diphosphate synthase. RNAi lines are dwarf. T-DNA knock-out lines are embryo lethal."	"-"	"-"	"data"
-0.52	"Os01t0316900-01"	"Os01g0316900"	"Conserved hypothetical protein."	"-"	"-"	"-"	"-"	"-"	"-"	"-"	"-"	"AK070437 (DDBJ, Best hit)"	"B9EVT7 (UniProt)"	"-"	"-"	"J023050F17"	"-"	"-"	"-"	"-"	"-"	"-"	"-"	"-"	"-"	"-"	"-"	"-"	"-"	"-"	"-"	"-"	"-"	"-"	"data"
-0.52	"Os10t0432300-01"	"Os10g0432300"	"Similar to Transcription factor IID, TFIID (Fragment)."	"-"	"-"	"-"	"-"	"-"	"-"	"Biological Process: regulation of transcription, DNA-dependent (GO:0006355), Biological Process: transcription initiation from RNA polymerase II promoter (GO:0006367), Molecular Function: DNA binding (GO:0003677), Molecular Function: binding (GO:0005488)"	"TATA-box binding protein (IPR000814), Transcription factor TFIID, C-terminal/DNA glycosylase, N-terminal (IPR012294), Beta2-adaptin/TATA-box binding, C-terminal (IPR012295)"	"AK108240 (DDBJ, Best hit)"	"P26356 (UniProt)"	"-"	"-"	"002-140-G12"	"-"	"AT1G55520.1"	"1"	"protein_coding"	"TATA binding protein 2"	"\"TATA-box binding protein. Required for basal transcription. Acts facilitating the recruitment of TFIID to the promoter, which together with the RNA polymerase form the preinitiation complex.\""	"\"TATA binding protein 2 (TBP2); CONTAINS InterPro DOMAIN/s: TATA-box binding (InterPro:IPR000814), Beta2-adaptin/TATA-box binding, C-terminal (InterPro:IPR012295), Transcription factor TFIID, C-terminal/DNA glycosylase, N-terminal (InterPro:IPR012294); BEST Arabidopsis thaliana protein match is: TATA binding protein 1 (TAIR:AT3G13445.1)\""	"\"ATTBP2,TBP2\""	"TATA binding protein 2"	"TBP2"	"\"ATTBP2,A. THALIANA TATA BINDING PROTEIN 2\""	"TATA binding protein 2"	"TATA binding protein 2 (TBP2)%3B CONTAINS InterPro DOMAIN/s: TATA-box binding (InterPro:IPR000814)%2C Beta2-adaptin/TATA-box binding%2C C-terminal (InterPro:IPR012295)%2C Transcription factor TFIID%2C C-terminal/DNA glycosylase%2C N-terminal (InterPro:IPR012294)%3B BEST Arabidopsis thaliana protein match is: TATA binding protein 1 (TAIR:AT3G13445.1)%3B Has 2123 Blast hits to 1580 proteins in 405 species: Archae - 736%3B Bacteria - 0%3B Metazoa - 578%3B Fungi - 191%3B Plants - 155%3B Viruses - 0%3B Other Eukaryotes - 463 (source: NCBI BLink)."	"\"PMID:10634912,PMID:9801140,PMID:8643494,PMID:7634102,PMID:8312743,PMID:14558660,PMID:16024589,PMID:17340043,PMID:18775970,PMID:21266657,PMID:23713077,locus:2193904\""	"protein_coding"	"TATA-box binding protein. Required for basal transcription. Acts facilitating the recruitment of TFIID to the promoter%2C which together with the RNA polymerase form the preinitiation complex."	"-"	"-"	"data"
-0.51	"Os03t0701700-02"	"Os03g0701700"	"Similar to Ethylene receptor."	"-"	"-"	"ERS1"	"ETHYLENE RECEPTOR"	"OS-ERS1, OsERS1, OsERS1a, OsERS1b, OSERS"	"ethylene responsive factor"	"Biological Process: signal transduction (GO:0007165), Biological Process: phosphorylation (GO:0016310), Biological Process: peptidyl-histidine phosphorylation (GO:0018106), Cellular Component: membrane (GO:0016020), Molecular Function: two-component sensor activity (GO:0000155), Molecular Function: protein histidine kinase activity (GO:0004673), Molecular Function: signal transducer activity (GO:0004871), Molecular Function: protein binding (GO:0005515), Molecular Function: ATP binding (GO:0005524), Molecular Function: transferase activity, transferring phosphorus-containing groups (GO:0016772)"	"GAF (IPR003018), ATPase-like, ATP-binding domain (IPR003594), Signal transduction histidine kinase, subgroup 1, dimerisation/phosphoacceptor domain (IPR003661), Signal transduction histidine kinase-related protein, C-terminal (IPR004358), Signal transduction histidine kinase, core (IPR005467), Signal transduction histidine kinase, homodimeric (IPR009082)"	"AK065161 (DDBJ, Best hit)"	"O24176 (UniProt)"	"-"	"-"	"J013002C04"	"9857"	"AT1G66340.1"	"2"	"protein_coding"	"\"Signal transduction histidine kinase, hybrid-type, ethylene sensor\""	"\"Similar to prokaryote sensory transduction proteins. Contains a histidine kinase and a response regulator domain. Homodimer. Membrane component. Binds ethylene. Mutations affect ethylene binding and metabolism of other plant hormones such as auxin, cytokinins, ABA and gibberellic acid. Ethylene receptor. Has histidine kinase activity. Is regulated by RTE1. Mutations in ETR1 block ethylene stimulation of flavonol synthesis.\""	"\"ETHYLENE RESPONSE 1 (ETR1); CONTAINS InterPro DOMAIN/s: Signal transduction histidine kinase, homodimeric (InterPro:IPR009082), Signal transduction histidine kinase, core (InterPro:IPR005467), Signal transduction histidine kinase, hybrid-type, ethylene sensor (InterPro:IPR014525), ATPase-like, ATP-binding domain (InterPro:IPR003594), CheY-like (InterPro:IPR011006), Signal transduction response regulator, receiver domain (InterPro:IPR001789), Signal transduction histidine kinase, subgroup 1, dimerisation/phosphoacceptor domain (InterPro:IPR003661), GAF (InterPro:IPR003018), Signal transduction histidine kinase-related protein, C-terminal (InterPro:IPR004358); BEST Arabidopsis thaliana protein match is: ethylene response sensor 1 (TAIR:AT2G40940.1)\""	"\"AtETR1,EIN1,ETR,ETR1\""	"Signal transduction histidine kinase%2C hybrid-type%2C ethylene sensor"	"ETR1"	"\"AtETR1,EIN1,ETHYLENE INSENSITIVE 1,ETR,ETHYLENE RESPONSE\""	"ETHYLENE RESPONSE 1"	"ETHYLENE RESPONSE 1 (ETR1)%3B CONTAINS InterPro DOMAIN/s: Signal transduction histidine kinase%2C homodimeric (InterPro:IPR009082)%2C Signal transduction histidine kinase%2C core (InterPro:IPR005467)%2C Signal transduction histidine kinase%2C hybrid-type%2C ethylene sensor (InterPro:IPR014525)%2C ATPase-like%2C ATP-binding domain (InterPro:IPR003594)%2C CheY-like (InterPro:IPR011006)%2C Signal transduction response regulator%2C receiver domain (InterPro:IPR001789)%2C Signal transduction histidine kinase%2C subgroup 1%2C dimerisation/phosphoacceptor domain (InterPro:IPR003661)%2C GAF (InterPro:IPR003018)%2C Signal transduction histidine kinase-related protein%2C C-terminal (InterPro:IPR004358)%3B BEST Arabidopsis thaliana protein match is: ethylene response sensor 1 (TAIR:AT2G40940.1)%3B Has 102721 Blast hits to 98263 proteins in 3046 species: Archae - 757%3B Bacteria - 90102%3B Metazoa - 18%3B Fungi - 1611%3B Plants - 2314%3B Viruses - 21%3B Other Eukaryotes - 7898 (source: NCBI BLink)."	"\"PMID:10938361,PMID:10930573,PMID:10899977,PMID:10890532,PMID:10828445,PMID:10816357,PMID:10792050,PMID:10715329,PMID:10647185,PMID:10645424,PMID:10482685,PMID:10475689,PMID:10409511,PMID:10364404,PMID:10333587,PMID:10318709,PMID:10318694,PMID:10036773,PMID:9974395,PMID:9952448,PMID:9800206,PMID:9800203,PMID:9761877,PMID:9724702,PMID:9721682,PMID:9707641,PMID:9707532,PMID:9695954,PMID:9691114,PMID:9636235,PMID:9560288,PMID:9576967,PMID:9482949,PMID:9489014,PMID:9465120,PMID:9297847,PMID:9247547,PMID:9215635,PMID:9225467,PMID:9191038,PMID:9131623,PMID:9109392,PMID:8914538,PMID:8758979,PMID:8704141,PMID:8525372,PMID:8525371,PMID:8577853,PMID:7569898,PMID:7610160,PMID:7759498,PMID:7770528,PMID:7770519,PMID:7768447,PMID:7855435,PMID:8211181,PMID:8329687,PMID:1472714,PMID:2152173,PMID:11041879,PMID:11027706,PMID:11019801,PMID:11123796,PMID:10664616,PMID:11605960,PMID:11884688,PMID:11842171,PMID:11916973,PMID:11038610,PMID:11541756,PMID:11607538,PMID:11161061,PMID:11094976,PMID:11439131,PMID:11169191,PMID:11319021,PMID:11340179,PMID:11402202,PMID:12028576,PMID:11950991,PMID:12091718,PMID:12177468,PMID:12060287,PMID:12271061,PMID:12242367,PMID:12232412,PMID:12226245,PMID:12432026,PMID:12376633,PMID:12355165,PMID:12481081,PMID:12481064,PMID:12472683,PMID:12535339,PMID:12535337,PMID:12509505,PMID:12644673,PMID:12628921,PMID:12606727,PMID:12709495,PMID:12692329,PMID:12663220,PMID:12746524,PMID:12721857,PMID:11722772,PMID:12821658,PMID:12805636,PMID:12881503,PMID:12953109,PMID:14558686,PMID:14523448,PMID:14617075,PMID:14600834,PMID:14701913,PMID:14680944,PMID:14675532,PMID:14675428,PMID:14673028,PMID:14658386,PMID:14732440,PMID:14756631,PMID:14756311,PMID:15044023,PMID:15282545,PMID:15358768,PMID:15466243,PMID:15466231,PMID:15466228,PMID:15466220,PMID:15643078,PMID:15703053,PMID:15773852,PMID:15843964,PMID:15923322,PMID:15923339,PMID:15879447,PMID:16173465,PMID:16255250,PMID:16311726,PMID:16415067,PMID:16640599,PMID:16682642,PMID:16798939,PMID:16891553,PMID:16961732,PMID:17071649,PMID:17049571,PMID:17189345,PMID:17158583,PMID:17224067,PMID:17202180,PMID:17313171,PMID:17284582,PMID:17644624,PMID:17601164,PMID:17931631,PMID:19825542,PMID:18000017,PMID:17999643,PMID:17981989,PMID:18363780,PMID:18452590,PMID:18577522,PMID:18643990,PMID:18943162,PMID:18838192,PMID:19017745,PMID:19095898,PMID:19190240,PMID:19369589,PMID:18384742,PMID:19196655,PMID:19549129,PMID:19516984,PMID:19704568,PMID:19769567,PMID:19732351,PMID:19843165,PMID:19829051,PMID:19825547,PMID:20030751,PMID:20016937,PMID:20016781,PMID:20085621,PMID:20062808,PMID:20374664,PMID:20357136,PMID:20505369,PMID:20447269,PMID:20531403,PMID:20627899,PMID:20592040,PMID:20713618,PMID:20699268,PMID:20876528,PMID:20876338,PMID:20835883,PMID:20826954,PMID:20820802,PMID:20952388,PMID:21117868,PMID:21198361,PMID:21333657,PMID:21309981,PMID:21427279,PMID:21386032,PMID:21477822,PMID:21575215,PMID:21689171,PMID:21666052,PMID:21771812,PMID:21832142,PMID:21815975,PMID:21912672,PMID:22227969,PMID:22416963,PMID:22409433,PMID:22451723,PMID:22467798,PMID:22499170,PMID:22591458,PMID:22566492,PMID:22563431,PMID:22712507,PMID:22706288,PMID:22692214,PMID:22827938,PMID:22822211,PMID:22818915,PMID:22902695,PMID:22995285,PMID:23043080,PMID:23188807,PMID:23271028,PMID:23305042,PMID:23457229,PMID:23452324,PMID:23616605,PMID:23553636,PMID:22390794,PMID:23166504,PMID:23124325,PMID:23759099,PMID:23728333,PMID:23673332,PMID:23874385,PMID:23989156,PMID:24104185,PMID:24444075,PMID:24306353,PMID:23903320,PMID:24014864,PMID:24192376,PMID:24635651,PMID:24696326,PMID:24833217,PMID:24820022,PMID:25221561,PMID:25534944,PMID:25494721,PMID:25704455,PMID:25682121,PMID:25680185,locus:2201552\""	"protein_coding"	"Similar to prokaryote sensory transduction proteins. Contains a histidine kinase and a response regulator domain. Homodimer. Membrane component. Binds ethylene. Mutations affect ethylene binding and metabolism of other plant hormones such as auxin%2C cytokinins%2C ABA and gibberellic acid. Ethylene receptor. Has histidine kinase activity. Is regulated by RTE1. Mutations in ETR1 block ethylene stimulation of flavonol synthesis."	"-"	"-"	"data"
-0.51	"Os03t0764100-01"	"Os03g0764100"	"Zinc finger transcription factor ZF1."	"-"	"-"	"-"	"-"	"WZF1"	"finger protein WZF1"	"Cellular Component: intracellular (GO:0005622), Molecular Function: nucleic acid binding (GO:0003676), Molecular Function: zinc ion binding (GO:0008270)"	"Zinc finger, C2H2 (IPR007087), Zinc finger, C2H2-type/integrase, DNA-binding (IPR013087), Zinc finger, C2H2-like (IPR015880)"	"AK072942 (DDBJ, Best hit)"	"Q9AXE9 (UniProt)"	"-"	"-"	"J023150M05"	"16038"	"-"	"-"	"-"	"-"	"-"	"-"	"-"	"-"	"-"	"-"	"-"	"-"	"-"	"-"	"-"	"-"	"-"	"data"
-0.51	"Os01t0835600-05"	"Os01g0835600"	"AT hook, DNA-binding, conserved site domain containing protein."	"-"	"-"	"-"	"-"	"-"	"-"	"Molecular Function: DNA binding (GO:0003677)"	"AT hook, DNA-binding motif (IPR017956), AT hook-like (IPR020478)"	"AK119267 (DDBJ, Best hit)"	"longestORF"	"-"	"-"	"001-130-A07"	"-"	"AT5G60010.1"	"1"	"protein_coding"	"ferric reductase-like transmembrane component family protein"	"NULL"	"\"ferric reductase-like transmembrane component family protein; FUNCTIONS IN: in 8 functions; INVOLVED IN: oxidation reduction; LOCATED IN: integral to membrane, membrane; EXPRESSED IN: 7 plant structures; EXPRESSED DURING: L mature pollen stage, M germinated pollen stage, 4 anthesis, LP.10 ten leaves visible, petal differentiation and expansion stage; CONTAINS InterPro DOMAIN/s: Ferredoxin reductase-type FAD-binding domain (InterPro:IPR017927), Cytochrome b245, heavy chain (InterPro:IPR000778), EF-Hand 1, calcium-binding site (InterPro:IPR018247), EF-hand-like domain (InterPro:IPR011992), Calcium-binding EF-hand (InterPro:IPR002048), Ferric reductase-like transmembrane component, N-terminal (InterPro:IPR013130), NADPH oxidase Respiratory burst (InterPro:IPR013623), Ferric reductase, NAD binding (InterPro:IPR013121), EF-HAND 2 (InterPro:IPR018249), FAD-binding 8 (InterPro:IPR013112), Riboflavin synthase-like beta-barrel (InterPro:IPR017938); BEST Arabidopsis thaliana protein match is: ferric reductase-like transmembrane component family protein (TAIR:AT3G45810.1)\""	"RbohH"	"ferric reductase-like transmembrane component family protein"	"-"	"\"RbohH,Respiratory burst oxidase homolog H\""	"-"	"ferric reductase-like transmembrane component family protein%3B FUNCTIONS IN: in 8 functions%3B INVOLVED IN: oxidation reduction%3B LOCATED IN: integral to membrane%2C membrane%3B EXPRESSED IN: 7 plant structures%3B EXPRESSED DURING: L mature pollen stage%2C M germinated pollen stage%2C 4 anthesis%2C LP.10 ten leaves visible%2C petal differentiation and expansion stage%3B CONTAINS InterPro DOMAIN/s: Ferredoxin reductase-type FAD-binding domain (InterPro:IPR017927)%2C Cytochrome b245%2C heavy chain (InterPro:IPR000778)%2C EF-Hand 1%2C calcium-binding site (InterPro:IPR018247)%2C EF-hand-like domain (InterPro:IPR011992)%2C Calcium-binding EF-hand (InterPro:IPR002048)%2C Ferric reductase-like transmembrane component%2C N-terminal (InterPro:IPR013130)%2C NADPH oxidase Respiratory burst (InterPro:IPR013623)%2C Ferric reductase%2C NAD binding (InterPro:IPR013121)%2C EF-HAND 2 (InterPro:IPR018249)%2C FAD-binding 8 (InterPro:IPR013112)%2C Riboflavin synthase-like beta-barrel (InterPro:IPR017938)%3B BEST Arabidopsis thaliana protein match is: ferric reductase-like transmembrane component family protein (TAIR:AT3G45810.1)%3B Has 1927 Blast hits to 1788 proteins in 283 species: Archae - 0%3B Bacteria - 154%3B Metazoa - 723%3B Fungi - 353%3B Plants - 523%3B Viruses - 0%3B Other Eukaryotes - 174 (source: NCBI BLink)."	"\"PMID:12372144,PMID:12773379,PMID:15923322,PMID:16362328,PMID:16607029,PMID:18775970,PMID:24610725,locus:2168113\""	"protein_coding"	"-"	"-"	"-"	"data"
-0.51	"Os05t0292200-01"	"Os05g0292200"	"Similar to Transcription factor IIA large subunit (TFIIA-L1)."	"-"	"-"	"-"	"-"	"-"	"-"	"Biological Process: transcription initiation from RNA polymerase II promoter (GO:0006367), Cellular Component: transcription factor TFIIA complex (GO:0005672)"	"Transcription factor IIA, alpha/beta subunit (IPR004855), Transcription factor IIA, helical (IPR009083), Transcription factor IIA, beta-barrel (IPR009088), Transcription factor IIA, alpha subunit, N-terminal (IPR013028)"	"AK065373 (DDBJ, Best hit)"	"B6T3Z3 (UniProt)"	"-"	"-"	"J013022M09"	"-"	"AT1G07480.2"	"2"	"protein_coding"	"\"Transcription factor IIA, alpha/beta subunit\""	"NULL"	"\"Transcription factor IIA, alpha/beta subunit; FUNCTIONS IN: RNA polymerase II transcription factor activity, sequence-specific DNA binding transcription factor activity; INVOLVED IN: transcription initiation from RNA polymerase II promoter, transcription; LOCATED IN: transcription factor TFIIA complex; CONTAINS InterPro DOMAIN/s: Transcription factor IIA, alpha/beta subunit (InterPro:IPR004855), Transcription factor IIA, beta-barrel (InterPro:IPR009088), Transcription factor IIA, alpha subunit, N-terminal (InterPro:IPR013028), Transcription factor IIA, helical (InterPro:IPR009083); BEST Arabidopsis thaliana protein match is: Transcription factor IIA, alpha/beta subunit (TAIR:AT1G07470.1)\""	"-"	"Transcription factor IIA%2C alpha/beta subunit"	"-"	"-"	"-"	"Transcription factor IIA%2C alpha/beta subunit%3B FUNCTIONS IN: RNA polymerase II transcription factor activity%2C sequence-specific DNA binding transcription factor activity%3B INVOLVED IN: transcription initiation from RNA polymerase II promoter%2C transcription%3B LOCATED IN: transcription factor TFIIA complex%3B CONTAINS InterPro DOMAIN/s: Transcription factor IIA%2C alpha/beta subunit (InterPro:IPR004855)%2C Transcription factor IIA%2C beta-barrel (InterPro:IPR009088)%2C Transcription factor IIA%2C alpha subunit%2C N-terminal (InterPro:IPR013028)%2C Transcription factor IIA%2C helical (InterPro:IPR009083)%3B BEST Arabidopsis thaliana protein match is: Transcription factor IIA%2C alpha/beta subunit (TAIR:AT1G07470.1)%3B Has 733 Blast hits to 623 proteins in 191 species: Archae - 0%3B Bacteria - 29%3B Metazoa - 394%3B Fungi - 169%3B Plants - 77%3B Viruses - 10%3B Other Eukaryotes - 54 (source: NCBI BLink)."	"\"PMID:12169696,locus:2024977\""	"protein_coding"	"-"	"-"	"-"	"data"
-0.51	"Os08t0127500-01"	"Os08g0127500"	"Acid phosphatase/vanadium-dependent haloperoxidase related family protein."	"-"	"-"	"-"	"-"	"-"	"-"	"-"	"Acid phosphatase/vanadium-dependent haloperoxidase-related (IPR003832)"	"AK071322 (DDBJ, Best hit)"	"NP_001150731.1 (RefSeq)"	"-"	"-"	"J023087N16"	"-"	"AT1G67600.1"	"1"	"protein_coding"	"Acid phosphatase/vanadium-dependent haloperoxidase-related protein"	"NULL"	"\"Acid phosphatase/vanadium-dependent haloperoxidase-related protein; FUNCTIONS IN: molecular_function unknown; INVOLVED IN: biological_process unknown; LOCATED IN: endomembrane system; EXPRESSED IN: 9 plant structures; EXPRESSED DURING: 4 anthesis, C globular stage, petal differentiation and expansion stage, D bilateral stage; CONTAINS InterPro DOMAIN/s: Acid phosphatase/vanadium-dependent haloperoxidase related (InterPro:IPR003832); BEST Arabidopsis thaliana protein match is: Acid phosphatase/vanadium-dependent haloperoxidase-related protein (TAIR:AT1G24350.1)\""	"-"	"Acid phosphatase/vanadium-dependent haloperoxidase-related protein"	"-"	"-"	"-"	"Acid phosphatase/vanadium-dependent haloperoxidase-related protein%3B FUNCTIONS IN: molecular_function unknown%3B INVOLVED IN: biological_process unknown%3B LOCATED IN: endomembrane system%3B EXPRESSED IN: 9 plant structures%3B EXPRESSED DURING: 4 anthesis%2C C globular stage%2C petal differentiation and expansion stage%2C D bilateral stage%3B CONTAINS InterPro DOMAIN/s: Acid phosphatase/vanadium-dependent haloperoxidase related (InterPro:IPR003832)%3B BEST Arabidopsis thaliana protein match is: Acid phosphatase/vanadium-dependent haloperoxidase-related protein (TAIR:AT1G24350.1)%3B Has 1114 Blast hits to 1114 proteins in 408 species: Archae - 0%3B Bacteria - 729%3B Metazoa - 0%3B Fungi - 0%3B Plants - 226%3B Viruses - 0%3B Other Eukaryotes - 159 (source: NCBI BLink)."	"locus:2008575"	"protein_coding"	"-"	"-"	"-"	"data"
