"correlation_high"	"Transcript_ID"	"Locus_ID"	"Description"	"RAP.DB.Gene.Symbol.Synonym.s."	"RAP.DB.Gene.Name.Synonym.s."	"CGSNL.Gene.Symbol"	"CGSNL.Gene.Name"	"Oryzabase.Gene.Symbol.Synonym.s."	"Oryzabase.Gene.Name.Synonym.s."	"GO"	"InterPro"	"Transcript.evidence"	"ORF.evidence"	"Curation.Date"	"Literature.PMID"	"FLcDNA.clone.ID"	"Oryzabase.Trait.Gene.ID"	"A.thaliana_gene_id"	"Reciprocal_flag"	"Type"	"Short_description"	"Curator_summary"	"Computational_description"	"gene.alias"	"Note"	"symbol"	"Alias"	"full_name"	"computational_description"	"Dbxref"	"locus_type"	"curator_summary"	"description"	"nochangenat.description"	"NormalizationGroup"
0.51	"Os02t0760000-00"	"Os02g0760000"	"Similar to chaperone protein dnaJ."	"-"	"-"	"-"	"-"	"OsDjC22"	"DnaJ domain protein C22"	"Biological Process: protein folding (GO:0006457), Molecular Function: heat shock protein binding (GO:0031072), Molecular Function: unfolded protein binding (GO:0051082)"	"Heat shock protein DnaJ, N-terminal (IPR001623), Heat shock protein DnaJ (IPR003095), Heat shock protein DnaJ, conserved site (IPR018253)"	"AK368960 (DDBJ)"	"B6UF39 (UniProt)"	"-"	"-"	"-"	"12179"	"AT2G33735.1"	"2"	"protein_coding"	"Chaperone DnaJ-domain superfamily protein"	"NULL"	"\"Chaperone DnaJ-domain superfamily protein; FUNCTIONS IN: unfolded protein binding, heat shock protein binding; INVOLVED IN: protein folding; LOCATED IN: cellular_component unknown; EXPRESSED IN: 20 plant structures; EXPRESSED DURING: 13 growth stages; CONTAINS InterPro DOMAIN/s: Molecular chaperone, heat shock protein, Hsp40, DnaJ (InterPro:IPR015609), Heat shock protein DnaJ, N-terminal (InterPro:IPR001623), Heat shock protein DnaJ (InterPro:IPR003095), Heat shock protein DnaJ, conserved site (InterPro:IPR018253); BEST Arabidopsis thaliana protein match is: Chaperone DnaJ-domain superfamily protein (TAIR:AT5G16650.1)\""	"-"	"Chaperone DnaJ-domain superfamily protein"	"-"	"-"	"-"	"Chaperone DnaJ-domain superfamily protein%3B FUNCTIONS IN: unfolded protein binding%2C heat shock protein binding%3B INVOLVED IN: protein folding%3B LOCATED IN: cellular_component unknown%3B EXPRESSED IN: 20 plant structures%3B EXPRESSED DURING: 13 growth stages%3B CONTAINS InterPro DOMAIN/s: Molecular chaperone%2C heat shock protein%2C Hsp40%2C DnaJ (InterPro:IPR015609)%2C Heat shock protein DnaJ%2C N-terminal (InterPro:IPR001623)%2C Heat shock protein DnaJ (InterPro:IPR003095)%2C Heat shock protein DnaJ%2C conserved site (InterPro:IPR018253)%3B BEST Arabidopsis thaliana protein match is: Chaperone DnaJ-domain superfamily protein (TAIR:AT5G16650.1)%3B Has 26 Blast hits to 26 proteins in 9 species: Archae - 0%3B Bacteria - 0%3B Metazoa - 0%3B Fungi - 0%3B Plants - 26%3B Viruses - 0%3B Other Eukaryotes - 0 (source: NCBI BLink)."	"\"PMID:15546358,locus:505006286\""	"protein_coding"	"-"	"-"	"-"	"data"
0.51	"Os06t0264700-01"	"Os06g0264700"	"Acylphosphatase domain containing protein."	"-"	"-"	"-"	"-"	"-"	"-"	"Molecular Function: acylphosphatase activity (GO:0003998)"	"Acylphosphatase-like (IPR001792), Acylphosphatase, conserved site (IPR017968), Acylphosphatase (IPR020456)"	"AK243118 (DDBJ, Best hit)"	"A3BAG9 (UniProt)"	"-"	"-"	"J100028B14"	"-"	"-"	"-"	"-"	"-"	"-"	"-"	"-"	"-"	"-"	"-"	"-"	"-"	"-"	"-"	"-"	"-"	"-"	"data"
0.51	"Os05t0200500-02"	"Os05g0200500"	"Similar to Casein kinase-like protein."	"-"	"-"	"-"	"-"	"-"	"-"	"-"	"-"	"AK100357 (DDBJ, Best hit), AK072116 (DDBJ, Best hit)"	"D8V7I8 (UniProt)"	"-"	"-"	"J023083K12, J013126I12"	"-"	"AT2G25760.1"	"1"	"protein_coding"	"Protein kinase family protein"	"NULL"	"\"Protein kinase family protein; FUNCTIONS IN: protein serine/threonine kinase activity, protein kinase activity, kinase activity, ATP binding; INVOLVED IN: protein amino acid phosphorylation; EXPRESSED IN: 22 plant structures; EXPRESSED DURING: 13 growth stages; CONTAINS InterPro DOMAIN/s: Protein kinase, ATP binding site (InterPro:IPR017441), Protein kinase, catalytic domain (InterPro:IPR000719), Serine/threonine-protein kinase domain (InterPro:IPR002290), Serine/threonine-protein kinase-like domain (InterPro:IPR017442), Protein kinase-like domain (InterPro:IPR011009), Serine/threonine-protein kinase, active site (InterPro:IPR008271); BEST Arabidopsis thaliana protein match is: Protein kinase family protein (TAIR:AT3G13670.1)\""	"-"	"Protein kinase family protein"	"-"	"-"	"-"	"Protein kinase family protein%3B FUNCTIONS IN: protein serine/threonine kinase activity%2C protein kinase activity%2C kinase activity%2C ATP binding%3B INVOLVED IN: protein amino acid phosphorylation%3B EXPRESSED IN: 22 plant structures%3B EXPRESSED DURING: 13 growth stages%3B CONTAINS InterPro DOMAIN/s: Protein kinase%2C ATP binding site (InterPro:IPR017441)%2C Protein kinase%2C catalytic domain (InterPro:IPR000719)%2C Serine/threonine-protein kinase domain (InterPro:IPR002290)%2C Serine/threonine-protein kinase-like domain (InterPro:IPR017442)%2C Protein kinase-like domain (InterPro:IPR011009)%2C Serine/threonine-protein kinase%2C active site (InterPro:IPR008271)%3B BEST Arabidopsis thaliana protein match is: Protein kinase family protein (TAIR:AT3G13670.1)%3B Has 17667 Blast hits to 17599 proteins in 1508 species: Archae - 20%3B Bacteria - 6581%3B Metazoa - 4779%3B Fungi - 1455%3B Plants - 2098%3B Viruses - 217%3B Other Eukaryotes - 2517 (source: NCBI BLink)."	"\"PMID:18650403,locus:2043475\""	"protein_coding"	"-"	"-"	"-"	"data"
0.52	"Os10t0500700-01"	"Os10g0500700"	"Glutaredoxin, Drought stress response"	"OsGRXS17"	"Glutaredoxin 17"	"GRX22"	"GLUTAREDOXIN 22"	"OsGRX22"	"glutaredoxin 22"	"Biological Process: cell redox homeostasis (GO:0045454), Molecular Function: electron carrier activity (GO:0009055), Molecular Function: protein disulfide oxidoreductase activity (GO:0015035)"	"Thioredoxin-like superfamily (IPR036249), Monothiol glutaredoxin-related (IPR004480), Thioredoxin domain (IPR013766), Glutaredoxin (IPR002109), Glutaredoxin, PICOT-like (IPR033658)"	"AK059628, AK067982"	"Q0IWL9"	"-"	"29162892"	"001-030-H12, J013121J12"	"13583"	"AT4G04950.1"	"2"	"protein_coding"	"thioredoxin family protein"	"\"Encodes a monothiol glutaredoxin that is a critical component involved in ROS accumulation, auxin signaling, and temperature-dependent postembryonic growth in plants.  It has been shown to associate with the cytosolic Fe-S assembly (CIA) complex and contributes to, but is not essential for, the correct functioning of client Fe-S proteins in unchallenged conditions.\""	"\"thioredoxin family protein; FUNCTIONS IN: electron carrier activity, protein disulfide oxidoreductase activity; INVOLVED IN: cell redox homeostasis; EXPRESSED IN: 23 plant structures; EXPRESSED DURING: 13 growth stages; CONTAINS InterPro DOMAIN/s: Thioredoxin fold (InterPro:IPR012335), Glutaredoxin (InterPro:IPR002109), Thioredoxin-like (InterPro:IPR017936), Thioredoxin domain (InterPro:IPR013766), Thioredoxin-like fold (InterPro:IPR012336), Glutaredoxin-related protein (InterPro:IPR004480); BEST Arabidopsis thaliana protein match is: Thioredoxin superfamily protein (TAIR:AT4G32580.1)\""	"\"AtGRXS17,GRXS17\""	"thioredoxin family protein"	"GRXS17"	"\"AtGRXS17,Arabidopsis thaliana monothiol glutaredoxin 17\""	"monothiol glutaredoxin 17"	"thioredoxin family protein%3B FUNCTIONS IN: electron carrier activity%2C protein disulfide oxidoreductase activity%3B INVOLVED IN: cell redox homeostasis%3B EXPRESSED IN: 23 plant structures%3B EXPRESSED DURING: 13 growth stages%3B CONTAINS InterPro DOMAIN/s: Thioredoxin fold (InterPro:IPR012335)%2C Glutaredoxin (InterPro:IPR002109)%2C Thioredoxin-like (InterPro:IPR017936)%2C Thioredoxin domain (InterPro:IPR013766)%2C Thioredoxin-like fold (InterPro:IPR012336)%2C Glutaredoxin-related protein (InterPro:IPR004480)%3B BEST Arabidopsis thaliana protein match is: Thioredoxin superfamily protein (TAIR:AT4G32580.1)%3B Has 26535 Blast hits to 17137 proteins in 2757 species: Archae - 249%3B Bacteria - 14010%3B Metazoa - 1647%3B Fungi - 1426%3B Plants - 1759%3B Viruses - 3%3B Other Eukaryotes - 7441 (source: NCBI BLink)."	"\"PMID:16547123,PMID:16720602,PMID:17031546,PMID:18650403,PMID:21515673,PMID:22762155,PMID:24203231,PMID:25699589,locus:2135363\""	"protein_coding"	"Encodes a monothiol glutaredoxin that is a critical component involved in ROS accumulation%2C auxin signaling%2C and temperature-dependent postembryonic growth in plants."	"-"	"-"	"data"
0.52	"Os08t0278900-01"	"Os08g0278900"	"MIR domain containing protein."	"-"	"-"	"-"	"-"	"-"	"SDF2-like gene"	"Cellular Component: membrane (GO:0016020)"	"MIR (IPR003608), MIR motif (IPR016093)"	"AK100085 (DDBJ, Best hit)"	"NP_565585.1 (RefSeq)"	"-"	"-"	"J023002O21"	"10090"	"AT2G25110.1"	"1"	"protein_coding"	"stromal cell-derived factor 2-like protein precursor"	"Encodes an endoplasmic reticulum protein SDF2 (stromal-derived factor-2).  Forms a complex SDF2-ERdj3B-BiP that is required for the proper accumulation of the surface-exposed leucine-rich repeat receptor kinases EFR.  EFR is involved in PAMP (pathogen associated molecular patterns) triggered immunity."	"\"stromal cell-derived factor 2-like protein precursor (SDF2); FUNCTIONS IN: molecular_function unknown; INVOLVED IN: defense response to bacterium, defense response to fungus, PAMP-induced immunity; LOCATED IN: endoplasmic reticulum, membrane; EXPRESSED IN: 25 plant structures; EXPRESSED DURING: 14 growth stages; CONTAINS InterPro DOMAIN/s: MIR (InterPro:IPR003608), MIR motif (InterPro:IPR016093)\""	"\"AtSDF2,ATSDL,SDF2\""	"stromal cell-derived factor 2-like protein precursor"	"SDF2"	"\"ATSDL,ATSDF2-LIKE,AtSDF2,Arabidopsis thaliana STROMAL CELL-DERIVED FACTOR 2-like protein precursor\""	"stromal cell-derived factor 2-like protein precursor"	"stromal cell-derived factor 2-like protein precursor (SDF2)%3B FUNCTIONS IN: molecular_function unknown%3B INVOLVED IN: defense response to bacterium%2C defense response to fungus%2C PAMP-induced immunity%3B LOCATED IN: endoplasmic reticulum%2C membrane%3B EXPRESSED IN: 25 plant structures%3B EXPRESSED DURING: 14 growth stages%3B CONTAINS InterPro DOMAIN/s: MIR (InterPro:IPR003608)%2C MIR motif (InterPro:IPR016093)%3B Has 1035 Blast hits to 992 proteins in 196 species: Archae - 0%3B Bacteria - 0%3B Metazoa - 386%3B Fungi - 512%3B Plants - 64%3B Viruses - 0%3B Other Eukaryotes - 73 (source: NCBI BLink)."	"\"PMID:12169696,PMID:12481097,PMID:15965014,PMID:15894741,PMID:15978049,PMID:16618929,PMID:18230180,PMID:18650403,PMID:18775970,PMID:19763086,PMID:20057059,PMID:21266257,PMID:24498907,locus:2040199\""	"protein_coding"	"Encodes an endoplasmic reticulum protein SDF2 (stromal-derived factor-2).  Forms a complex SDF2-ERdj3B-BiP that is required for the proper accumulation of the surface-exposed leucine-rich repeat receptor kinases EFR.  EFR is involved in PAMP (pathogen associated molecular patterns) triggered immunity."	"-"	"-"	"data"
0.52	"Os07t0546200-01"	"Os07g0546200"	"Conserved hypothetical protein."	"-"	"-"	"-"	"-"	"-"	"-"	"-"	"-"	"AK067303 (DDBJ, Best hit)"	"B9FXS3 (UniProt)"	"-"	"-"	"J013102C16"	"-"	"-"	"-"	"-"	"-"	"-"	"-"	"-"	"-"	"-"	"-"	"-"	"-"	"-"	"-"	"-"	"-"	"-"	"data"
0.52	"Os04t0613300-01"	"Os04g0613300"	"Protein of unknown function DUF2358 domain containing protein."	"-"	"-"	"-"	"-"	"-"	"-"	"-"	"Protein of unknown function DUF2358 (IPR018790)"	"AK065653 (DDBJ, Best hit)"	"A3AXC3 (UniProt)"	"-"	"-"	"J013037F04"	"-"	"AT1G16320.1"	"2"	"protein_coding"	"Uncharacterized conserved protein (DUF2358)"	"NULL"	"Uncharacterized conserved protein (DUF2358); FUNCTIONS IN: molecular_function unknown; INVOLVED IN: biological_process unknown; LOCATED IN: chloroplast; CONTAINS InterPro DOMAIN/s: Protein of unknown function DUF2358 (InterPro:IPR018790); BEST Arabidopsis thaliana protein match is: Uncharacterized conserved protein (DUF2358) (TAIR:AT1G79510.2)"	"-"	"plant/protein (DUF2358)"	"-"	"-"	"-"	"Uncharacterized conserved protein (DUF2358)%3B FUNCTIONS IN: molecular_function unknown%3B INVOLVED IN: biological_process unknown%3B LOCATED IN: chloroplast%3B CONTAINS InterPro DOMAIN/s: Protein of unknown function DUF2358 (InterPro:IPR018790)%3B BEST Arabidopsis thaliana protein match is: Uncharacterized conserved protein (DUF2358) (TAIR:AT1G79510.2)%3B Has 274 Blast hits to 274 proteins in 79 species: Archae - 0%3B Bacteria - 78%3B Metazoa - 80%3B Fungi - 0%3B Plants - 99%3B Viruses - 0%3B Other Eukaryotes - 17 (source: NCBI BLink)."	"\"PMID:14576160,locus:2032850\""	"protein_coding"	"-"	"-"	"-"	"data"
0.52	"Os11t0145400-01"	"Os11g0145400"	"Similar to GRF zinc finger family protein."	"-"	"-"	"-"	"-"	"-"	"-"	"Molecular Function: protein binding (GO:0005515)"	"Ubiquitin (IPR000626), Ubiquitin supergroup (IPR019955)"	"AK242499 (DDBJ, Best hit)"	"Q2QXT9 (UniProt)"	"-"	"-"	"J080308D02"	"-"	"AT3G45180.1"	"2"	"protein_coding"	"Ubiquitin-like superfamily protein"	"NULL"	"\"Ubiquitin-like superfamily protein; CONTAINS InterPro DOMAIN/s: Ubiquitin (InterPro:IPR000626), Ubiquitin supergroup (InterPro:IPR019955); BEST Arabidopsis thaliana protein match is: ubiquitin-like protein 5 (TAIR:AT5G42300.1)\""	"-"	"Ubiquitin-like superfamily protein"	"-"	"-"	"-"	"Ubiquitin-like superfamily protein%3B CONTAINS InterPro DOMAIN/s: Ubiquitin (InterPro:IPR000626)%2C Ubiquitin supergroup (InterPro:IPR019955)%3B BEST Arabidopsis thaliana protein match is: ubiquitin-like protein 5 (TAIR:AT5G42300.1)%3B Has 399 Blast hits to 399 proteins in 174 species: Archae - 0%3B Bacteria - 0%3B Metazoa - 169%3B Fungi - 99%3B Plants - 81%3B Viruses - 0%3B Other Eukaryotes - 50 (source: NCBI BLink)."	"\"PMID:16400686,locus:2096870\""	"protein_coding"	"-"	"-"	"-"	"data"
0.52	"Os03t0161900-01"	"Os03g0161900"	"Similar to Isoform 2 of Heat stress transcription factor A-2d."	"-"	"-"	"HSFA2D"	"HEAT STRESS TRANSCRIPTION FACTOR A2D"	"HSfA2d, OsHsfA2d, OsHsf-08, rHsf7, HSF08, HSF7, OsHSF7, OsHSFA2dI, OsHSFA2dII, OsHSFA2dIII"	"Heat stress transcription factor A2d, Heat stress transcription factor A-2d, Heat stress transcription factor 8, Heat stress transcription factor 7"	"-"	"-"	"AK066844 (DDBJ, Best hit)"	"Q8H7Y6-2 (UniProt)"	"-"	"-"	"J013088J01"	"8551"	"AT2G26150.2"	"1"	"protein_coding"	"heat shock transcription factor A2"	"member of Heat Stress Transcription Factor (Hsf) family. Involved in response to misfolded protein accumulation in the cytosol. Regulated by alternative splicing and non-sense-mediated decay."	"\"heat shock transcription factor A2 (HSFA2); FUNCTIONS IN: DNA binding, transcription activator activity, sequence-specific DNA binding transcription factor activity; INVOLVED IN: in 7 processes; LOCATED IN: endomembrane system, nucleus; EXPRESSED IN: 8 plant structures; EXPRESSED DURING: 4 anthesis, C globular stage, petal differentiation and expansion stage; CONTAINS InterPro DOMAIN/s: Winged helix-turn-helix transcription repressor DNA-binding (InterPro:IPR011991), Heat shock factor (HSF)-type, DNA-binding (InterPro:IPR000232); BEST Arabidopsis thaliana protein match is: heat shock transcription factor A1D (TAIR:AT1G32330.1)\""	"\"ATHSFA2,HSFA2\""	"heat shock transcription factor A2"	"HSFA2"	"\"ATHSFA2,heat shock transcription factor A2\""	"heat shock transcription factor A2"	"heat shock transcription factor A2 (HSFA2)%3B FUNCTIONS IN: DNA binding%2C transcription activator activity%2C sequence-specific DNA binding transcription factor activity%3B INVOLVED IN: in 7 processes%3B LOCATED IN: nucleus%3B EXPRESSED IN: 8 plant structures%3B EXPRESSED DURING: 4 anthesis%2C C globular stage%2C petal differentiation and expansion stage%3B CONTAINS InterPro DOMAIN/s: Winged helix-turn-helix transcription repressor DNA-binding (InterPro:IPR011991)%2C Heat shock factor (HSF)-type%2C DNA-binding (InterPro:IPR000232)%3B BEST Arabidopsis thaliana protein match is: heat shock transcription factor  A6B (TAIR:AT3G22830.1)%3B Has 2162 Blast hits to 2147 proteins in 231 species: Archae - 0%3B Bacteria - 0%3B Metazoa - 326%3B Fungi - 474%3B Plants - 849%3B Viruses - 0%3B Other Eukaryotes - 513 (source: NCBI BLink)."	"\"PMID:9222607,PMID:11118137,PMID:12417700,PMID:16649111,PMID:17059409,PMID:17085506,PMID:17722694,PMID:17890230,PMID:18201973,PMID:18502973,PMID:19125253,PMID:19244141,PMID:19366428,PMID:19342427,PMID:16483133,PMID:19352026,PMID:19704521,PMID:19704439,PMID:19876748,PMID:20089772,PMID:20147301,PMID:20388662,PMID:20458611,PMID:20521085,PMID:21398256,PMID:21510947,PMID:21471117,PMID:21908690,PMID:22037706,PMID:22570631,PMID:22710144,PMID:23073024,PMID:23238922,PMID:23370720,PMID:23503691,PMID:23832625,PMID:23918368,PMID:24377444,PMID:24265778,PMID:24548003,PMID:24580679,PMID:24769482,PMID:25619826,PMID:25575991,PMID:25711624,locus:2057371\""	"protein_coding"	"member of Heat Stress Transcription Factor (Hsf) family. Involved in response to misfolded protein accumulation in the cytosol. Regulated by alternative splicing and non-sense-mediated decay."	"-"	"-"	"data"
0.52	"Os06t0231300-01"	"Os06g0231300"	"CS domain domain containing protein."	"-"	"-"	"-"	"-"	"ROX3"	"Regulator of XA21-3"	"-"	"CS-like domain (IPR007052), HSP20-like chaperone (IPR008978), CS domain (IPR017447)"	"AK073934 (DDBJ, Best hit)"	"B6T728 (UniProt)"	"-"	"-"	"J033076L21"	"9790"	"AT5G53400.1"	"2"	"protein_coding"	"HSP20-like chaperones superfamily protein"	"\"Encodes BOBBER1 (BOB1), a non-canonical small heat shock protein required for both development and thermotolerance. BOB1 is cytoplasmic at basal temperatures but forms heat shock granules containing canonical small heat shock proteins at high temperatures. The mRNA is cell-to-cell mobile.\""	"\"BOBBER1 (BOB1); CONTAINS InterPro DOMAIN/s: CS-like domain (InterPro:IPR007052), HSP20-like chaperone (InterPro:IPR008978), CS domain (InterPro:IPR017447); BEST Arabidopsis thaliana protein match is: HSP20-like chaperones superfamily protein (TAIR:AT4G27890.1)\""	"BOB1"	"HSP20-like chaperones superfamily protein"	"BOB1"	"-"	"BOBBER1"	"BOBBER1 (BOB1)%3B CONTAINS InterPro DOMAIN/s: CS-like domain (InterPro:IPR007052)%2C HSP20-like chaperone (InterPro:IPR008978)%2C CS domain (InterPro:IPR017447)%3B BEST Arabidopsis thaliana protein match is: HSP20-like chaperones superfamily protein (TAIR:AT4G27890.1)%3B Has 1807 Blast hits to 1807 proteins in 277 species: Archae - 0%3B Bacteria - 0%3B Metazoa - 736%3B Fungi - 347%3B Plants - 385%3B Viruses - 0%3B Other Eukaryotes - 339 (source: NCBI BLink)."	"\"PMID:15047901,PMID:16623895,PMID:16720694,PMID:18650403,PMID:18775970,PMID:19571304,PMID:19648297,PMID:19829061,PMID:21477822,PMID:23213410,PMID:23396601,PMID:24064926,locus:2178431\""	"protein_coding"	"Encodes BOBBER1 (BOB1)%2C a non-canonical small heat shock protein required for both development and thermotolerance. BOB1 is cytoplasmic at basal temperatures but forms heat shock granules containing canonical small heat shock proteins at high temperatures."	"-"	"-"	"data"
0.52	"Os09t0510200-01"	"Os09g0510200"	"Protein of unknown function DUF667 family protein."	"-"	"-"	"-"	"-"	"-"	"-"	"-"	"Protein of unknown function DUF667 (IPR007714)"	"AK108370 (DDBJ, Best hit)"	"B6T7P6 (UniProt)"	"-"	"-"	"002-142-D07"	"-"	"AT3G12300.1"	"2"	"protein_coding"	"NULL"	"\"Similar to Bug22p in Paramecium, a conserved centrosomal/ciliary protein. This protein is widespread in eukaryotes harboring centrioles/cilia at some stage of their life cycles. Among eukaryotes devoid of centrioles/cilia, plants possess BUG22 genes whereas some fungi (at least ascomycetes) do not.\""	"unknown protein; FUNCTIONS IN: molecular_function unknown; INVOLVED IN: biological_process unknown; LOCATED IN: endomembrane system; EXPRESSED IN: 23 plant structures; EXPRESSED DURING: 15 growth stages; CONTAINS InterPro DOMAIN/s: Protein of unknown function DUF667 (InterPro:IPR007714)"	"\"AtBUG22,BUG22\""	"cilia/flagella-associated protein"	"BUG22"	"-"	"-"	"unknown protein%3B FUNCTIONS IN: molecular_function unknown%3B INVOLVED IN: biological_process unknown%3B LOCATED IN: endomembrane system%3B EXPRESSED IN: 23 plant structures%3B EXPRESSED DURING: 15 growth stages%3B CONTAINS InterPro DOMAIN/s: Protein of unknown function DUF667 (InterPro:IPR007714)%3B Has 373 Blast hits to 371 proteins in 116 species: Archae - 0%3B Bacteria - 0%3B Metazoa - 213%3B Fungi - 4%3B Plants - 71%3B Viruses - 0%3B Other Eukaryotes - 85 (source: NCBI BLink)."	"\"PMID:14535883,PMID:15377757,PMID:15703057,PMID:18775970,PMID:22208660,PMID:20118210,locus:2082184\""	"protein_coding"	"Similar to Bug22p in Paramecium%2C a conserved centrosomal/ciliary protein. This protein is widespread in eukaryotes harboring centrioles/cilia at some stage of their life cycles. Among eukaryotes devoid of centrioles/cilia%2C plants possess BUG22 genes whereas some fungi (at least ascomycetes) do not."	"-"	"-"	"data"
0.53	"Os04t0352400-01"	"Os04g0352400"	"Peptidyl-prolyl cis-trans isomerase, FKBP-type domain containing protein."	"-"	"-"	"-"	"-"	"OsFKBP62b, OsFKBP65"	"FK506 binding protein 62b, FK506 binding protein 65"	"Biological Process: protein folding (GO:0006457), Molecular Function: binding (GO:0005488), Molecular Function: protein binding (GO:0005515)"	"Peptidyl-prolyl cis-trans isomerase, FKBP-type, domain (IPR001179), Tetratricopeptide-like helical (IPR011990), Tetratricopeptide repeat-containing (IPR013026), Tetratricopeptide repeat (IPR019734), Elongated TPR repeat-containing domain (IPR023114), Peptidyl-prolyl cis-trans isomerase, FKBP-type (IPR023566)"	"AK100844 (DDBJ, Best hit)"	"O04843 (UniProt)"	"-"	"-"	"J023123G09"	"10048"	"AT3G25230.1"	"1"	"protein_coding"	"rotamase FKBP 1"	"\"Encodes a a high molecular weight member of the FK506 binding protein (FKBP) family.  It has three FKBP12-like domains, tetratricopeptide repeats, and a putative calmodulin binding domain. Modulates thermotolerance by interacting with HSP90.1 and affecting the accumulation of HsfA2-regulated sHSPs. Belongs to one of the 36 carboxylate clamp (CC)-tetratricopeptide repeat (TPR) proteins (Prasad 2010, Pubmed ID: 20856808) with potential to interact with Hsp90/Hsp70 as co-chaperones.\""	"\"rotamase FKBP 1 (ROF1); FUNCTIONS IN: FK506 binding, peptidyl-prolyl cis-trans isomerase activity, calmodulin binding; INVOLVED IN: response to cadmium ion, response to heat, response to wounding; LOCATED IN: nucleus, cytoplasm; EXPRESSED IN: 26 plant structures; EXPRESSED DURING: 15 growth stages; CONTAINS InterPro DOMAIN/s: Tetratricopeptide TPR-1 (InterPro:IPR001440), Tetratricopeptide-like helical (InterPro:IPR011990), Tetratricopeptide repeat-containing (InterPro:IPR013026), Tetratricopeptide repeat (InterPro:IPR019734), Peptidyl-prolyl cis-trans isomerase, FKBP-type (InterPro:IPR001179); BEST Arabidopsis thaliana protein match is: FKBP-type peptidyl-prolyl cis-trans isomerase family protein (TAIR:AT5G48570.1)\""	"\"ATFKBP62,FKBP62,ROF1\""	"rotamase FKBP 1"	"ROF1"	"\"ATFKBP62,FKBP62,FK506 BINDING PROTEIN 62\""	"rotamase FKBP 1"	"rotamase FKBP 1 (ROF1)%3B FUNCTIONS IN: FK506 binding%2C peptidyl-prolyl cis-trans isomerase activity%2C calmodulin binding%3B INVOLVED IN: response to cadmium ion%2C response to heat%2C response to wounding%3B LOCATED IN: nucleus%2C cytoplasm%3B EXPRESSED IN: 26 plant structures%3B EXPRESSED DURING: 15 growth stages%3B CONTAINS InterPro DOMAIN/s: Tetratricopeptide TPR-1 (InterPro:IPR001440)%2C Tetratricopeptide-like helical (InterPro:IPR011990)%2C Tetratricopeptide repeat-containing (InterPro:IPR013026)%2C Tetratricopeptide repeat (InterPro:IPR019734)%2C Peptidyl-prolyl cis-trans isomerase%2C FKBP-type (InterPro:IPR001179)%3B BEST Arabidopsis thaliana protein match is: FKBP-type peptidyl-prolyl cis-trans isomerase family protein (TAIR:AT5G48570.1)%3B Has 23486 Blast hits to 15115 proteins in 1840 species: Archae - 212%3B Bacteria - 9362%3B Metazoa - 6200%3B Fungi - 1716%3B Plants - 1995%3B Viruses - 0%3B Other Eukaryotes - 4001 (source: NCBI BLink)."	"\"PMID:8914512,PMID:11782485,PMID:15047905,PMID:15047901,PMID:15133126,PMID:16258011,PMID:16502469,PMID:16887800,PMID:17080288,PMID:18055584,PMID:18212028,PMID:18775970,PMID:19366428,PMID:19876748,PMID:20118269,PMID:20856808,PMID:22134914,PMID:22268595,PMID:23133621,PMID:24064926,locus:2090265\""	"protein_coding"	"Encodes a a high molecular weight member of the FK506 binding protein (FKBP) family.  It has three FKBP12-like domains%2C tetratricopeptide repeats%2C and a putative calmodulin binding domain. Modulates thermotolerance by interacting with HSP90.1 and affecting the accumulation of HsfA2-regulated sHSPs. Belongs to one of the 36 carboxylate clamp (CC)-tetratricopeptide repeat (TPR) proteins (Prasad 2010%2C Pubmed ID: 20856808) with potential to interact with Hsp90/Hsp70 as co-chaperones."	"-"	"-"	"data"
