"correlation_high"	"Transcript_ID"	"Locus_ID"	"Description"	"RAP.DB.Gene.Symbol.Synonym.s."	"RAP.DB.Gene.Name.Synonym.s."	"CGSNL.Gene.Symbol"	"CGSNL.Gene.Name"	"Oryzabase.Gene.Symbol.Synonym.s."	"Oryzabase.Gene.Name.Synonym.s."	"GO"	"InterPro"	"Transcript.evidence"	"ORF.evidence"	"Curation.Date"	"Literature.PMID"	"FLcDNA.clone.ID"	"Oryzabase.Trait.Gene.ID"	"A.thaliana_gene_id"	"Reciprocal_flag"	"Type"	"Short_description"	"Curator_summary"	"Computational_description"	"gene.alias"	"Note"	"symbol"	"Alias"	"full_name"	"computational_description"	"Dbxref"	"locus_type"	"curator_summary"	"description"	"nochangenat.description"	"NormalizationGroup"
0.55	"Os02t0491400-01"	"Os02g0491400"	"Similar to Peptidylprolyl isomerase."	"-"	"-"	"-"	"-"	"OsFKBP62c, OsFKBP75"	"FK506 binding protein 62c, FK506 binding protein 75"	"Biological Process: protein folding (GO:0006457), Molecular Function: binding (GO:0005488), Molecular Function: protein binding (GO:0005515)"	"Peptidyl-prolyl cis-trans isomerase, FKBP-type, domain (IPR001179), Tetratricopeptide TPR-1 (IPR001440), Tetratricopeptide-like helical (IPR011990), Tetratricopeptide repeat-containing (IPR013026), Tetratricopeptide repeat (IPR019734), Elongated TPR repeat-containing domain (IPR023114), Peptidyl-prolyl cis-trans isomerase, FKBP-type (IPR023566)"	"AK073233 (DDBJ, Best hit)"	"B9F026 (UniProt)"	"-"	"-"	"J033023H01"	"10049"	"AT3G25230.1"	"1"	"protein_coding"	"rotamase FKBP 1"	"\"Encodes a a high molecular weight member of the FK506 binding protein (FKBP) family.  It has three FKBP12-like domains, tetratricopeptide repeats, and a putative calmodulin binding domain. Modulates thermotolerance by interacting with HSP90.1 and affecting the accumulation of HsfA2-regulated sHSPs. Belongs to one of the 36 carboxylate clamp (CC)-tetratricopeptide repeat (TPR) proteins (Prasad 2010, Pubmed ID: 20856808) with potential to interact with Hsp90/Hsp70 as co-chaperones.\""	"\"rotamase FKBP 1 (ROF1); FUNCTIONS IN: FK506 binding, peptidyl-prolyl cis-trans isomerase activity, calmodulin binding; INVOLVED IN: response to cadmium ion, response to heat, response to wounding; LOCATED IN: nucleus, cytoplasm; EXPRESSED IN: 26 plant structures; EXPRESSED DURING: 15 growth stages; CONTAINS InterPro DOMAIN/s: Tetratricopeptide TPR-1 (InterPro:IPR001440), Tetratricopeptide-like helical (InterPro:IPR011990), Tetratricopeptide repeat-containing (InterPro:IPR013026), Tetratricopeptide repeat (InterPro:IPR019734), Peptidyl-prolyl cis-trans isomerase, FKBP-type (InterPro:IPR001179); BEST Arabidopsis thaliana protein match is: FKBP-type peptidyl-prolyl cis-trans isomerase family protein (TAIR:AT5G48570.1)\""	"\"ATFKBP62,FKBP62,ROF1\""	"rotamase FKBP 1"	"ROF1"	"\"ATFKBP62,FKBP62,FK506 BINDING PROTEIN 62\""	"rotamase FKBP 1"	"rotamase FKBP 1 (ROF1)%3B FUNCTIONS IN: FK506 binding%2C peptidyl-prolyl cis-trans isomerase activity%2C calmodulin binding%3B INVOLVED IN: response to cadmium ion%2C response to heat%2C response to wounding%3B LOCATED IN: nucleus%2C cytoplasm%3B EXPRESSED IN: 26 plant structures%3B EXPRESSED DURING: 15 growth stages%3B CONTAINS InterPro DOMAIN/s: Tetratricopeptide TPR-1 (InterPro:IPR001440)%2C Tetratricopeptide-like helical (InterPro:IPR011990)%2C Tetratricopeptide repeat-containing (InterPro:IPR013026)%2C Tetratricopeptide repeat (InterPro:IPR019734)%2C Peptidyl-prolyl cis-trans isomerase%2C FKBP-type (InterPro:IPR001179)%3B BEST Arabidopsis thaliana protein match is: FKBP-type peptidyl-prolyl cis-trans isomerase family protein (TAIR:AT5G48570.1)%3B Has 23486 Blast hits to 15115 proteins in 1840 species: Archae - 212%3B Bacteria - 9362%3B Metazoa - 6200%3B Fungi - 1716%3B Plants - 1995%3B Viruses - 0%3B Other Eukaryotes - 4001 (source: NCBI BLink)."	"\"PMID:8914512,PMID:11782485,PMID:15047905,PMID:15047901,PMID:15133126,PMID:16258011,PMID:16502469,PMID:16887800,PMID:17080288,PMID:18055584,PMID:18212028,PMID:18775970,PMID:19366428,PMID:19876748,PMID:20118269,PMID:20856808,PMID:22134914,PMID:22268595,PMID:23133621,PMID:24064926,locus:2090265\""	"protein_coding"	"Encodes a a high molecular weight member of the FK506 binding protein (FKBP) family.  It has three FKBP12-like domains%2C tetratricopeptide repeats%2C and a putative calmodulin binding domain. Modulates thermotolerance by interacting with HSP90.1 and affecting the accumulation of HsfA2-regulated sHSPs. Belongs to one of the 36 carboxylate clamp (CC)-tetratricopeptide repeat (TPR) proteins (Prasad 2010%2C Pubmed ID: 20856808) with potential to interact with Hsp90/Hsp70 as co-chaperones."	"-"	"-"	"data"
0.55	"Os07t0267300-01"	"Os07g0267300"	"Hypothetical gene."	"-"	"-"	"-"	"-"	"-"	"-"	"-"	"-"	"AK120463 (DDBJ, Best hit), AK071612 (DDBJ, Best hit)"	"longestORF"	"-"	"-"	"J013107O16, J023104L09"	"-"	"-"	"-"	"-"	"-"	"-"	"-"	"-"	"-"	"-"	"-"	"-"	"-"	"-"	"-"	"-"	"-"	"-"	"data"
0.55	"Os06t0691600-01"	"Os06g0691600"	"EF-Hand type domain containing protein."	"-"	"-"	"CML29"	"CALMODULIN-LIKE PROTEIN 29"	"OsCML29"	"calmodulin-like protein 29"	"Molecular Function: calcium ion binding (GO:0005509)"	"Calcium-binding EF-hand (IPR002048), EF-hand-like domain (IPR011992), EF-Hand 1, calcium-binding site (IPR018247), EF-hand (IPR018248), EF-HAND 2 (IPR018249)"	"AK070430 (DDBJ, Best hit)"	"NP_001150907.1 (RefSeq)"	"-"	"-"	"J023048H06"	"10512"	"-"	"-"	"-"	"-"	"-"	"-"	"-"	"-"	"-"	"-"	"-"	"-"	"-"	"-"	"-"	"-"	"-"	"data"
0.55	"Os02t0259900-01"	"Os02g0259900"	"Conserved hypothetical protein."	"-"	"-"	"-"	"-"	"-"	"-"	"-"	"-"	"AK063689 (DDBJ, Best hit)"	"B9F4V8 (UniProt)"	"-"	"-"	"001-119-F07"	"-"	"-"	"-"	"-"	"-"	"-"	"-"	"-"	"-"	"-"	"-"	"-"	"-"	"-"	"-"	"-"	"-"	"-"	"data"
0.55	"Os06t0198500-00"	"Os06g0198500"	"RmlC-like jelly roll fold domain containing protein."	"-"	"-"	"-"	"-"	"-"	"-"	"-"	"Protein of unknown function DUF985 (IPR009327), Cupin, RmlC-type (IPR011051), RmlC-like jelly roll fold (IPR014710)"	"EU945799 (DDBJ)"	"Q9LMB4 (UniProt)"	"-"	"-"	"-"	"-"	"AT1G19130.1"	"2"	"protein_coding"	"NULL"	"NULL"	"\"CONTAINS InterPro DOMAIN/s: Protein of unknown function DUF985 (InterPro:IPR009327), RmlC-like jelly roll fold (InterPro:IPR014710)\""	"-"	"RmlC-like jelly roll fold protein"	"-"	"-"	"-"	"CONTAINS InterPro DOMAIN/s: Protein of unknown function DUF985 (InterPro:IPR009327)%2C RmlC-like jelly roll fold (InterPro:IPR014710)%3B Has 1465 Blast hits to 1465 proteins in 584 species: Archae - 10%3B Bacteria - 1038%3B Metazoa - 19%3B Fungi - 43%3B Plants - 51%3B Viruses - 0%3B Other Eukaryotes - 304 (source: NCBI BLink)."	"\"PMID:18650403,PMID:20118269,locus:2011251\""	"protein_coding"	"-"	"-"	"-"	"data"
0.55	"Os03t0218500-01"	"Os03g0218500"	"Similar to 70kD heat shock protein."	"-"	"-"	"-"	"-"	"-"	"-"	"Molecular Function: ATP binding (GO:0005524)"	"Heat shock protein Hsp70 (IPR001023), Heat shock protein 70 (IPR013126), Heat shock protein 70, conserved site (IPR018181)"	"AK102685 (DDBJ, Best hit)"	"NP_001148098.1 (RefSeq)"	"-"	"-"	"J033102M24"	"-"	"AT2G32120.1"	"2"	"protein_coding"	"heat-shock protein 70T-2"	"NULL"	"\"heat-shock protein 70T-2 (HSP70T-2); FUNCTIONS IN: ATP binding; INVOLVED IN: protein folding, response to high light intensity, response to hydrogen peroxide, response to heat; LOCATED IN: cellular_component unknown; EXPRESSED IN: 23 plant structures; EXPRESSED DURING: 12 growth stages; CONTAINS InterPro DOMAIN/s: Heat shock protein 70, conserved site (InterPro:IPR018181), Heat shock protein Hsp70 (InterPro:IPR001023), Heat shock protein 70 (InterPro:IPR013126); BEST Arabidopsis thaliana protein match is: heat shock protein 70 (TAIR:AT3G12580.1)\""	"HSP70T-2"	"heat-shock protein 70T-2"	"HSP70T-2"	"-"	"heat-shock protein 70T-2"	"heat-shock protein 70T-2 (HSP70T-2)%3B FUNCTIONS IN: ATP binding%3B INVOLVED IN: protein folding%2C response to high light intensity%2C response to hydrogen peroxide%2C response to heat%3B LOCATED IN: cellular_component unknown%3B EXPRESSED IN: 23 plant structures%3B EXPRESSED DURING: 12 growth stages%3B CONTAINS InterPro DOMAIN/s: Heat shock protein 70%2C conserved site (InterPro:IPR018181)%2C Heat shock protein Hsp70 (InterPro:IPR001023)%2C Heat shock protein 70 (InterPro:IPR013126)%3B BEST Arabidopsis thaliana protein match is: heat shock protein 70 (TAIR:AT3G12580.1)%3B Has 23745 Blast hits to 23668 proteins in 4473 species: Archae - 147%3B Bacteria - 10488%3B Metazoa - 3198%3B Fungi - 1451%3B Plants - 1078%3B Viruses - 114%3B Other Eukaryotes - 7269 (source: NCBI BLink)."	"\"PMID:11402207,PMID:15047901,PMID:16258017,PMID:16720694,PMID:17059409,PMID:17513503,PMID:18252252,PMID:20493581,locus:2045457\""	"protein_coding"	"-"	"-"	"-"	"data"
0.55	"Os01t0136100-01"	"Os01g0136100"	"16.9 kDa class I heat shock protein 1."	"-"	"-"	"HSP16.9A"	"16.9 KDA CLASS I HEAT SHOCK PROTEIN 1"	"Oshsp16.9A, OsHsp16.9A, HSP16.9A, OsHSP16.9A-CI"	"16.9 kDa class I heat shock protein 1, 16.9 kDa heat shock protein 1"	"-"	"Heat shock protein Hsp20 (IPR002068), HSP20-like chaperone (IPR008978)"	"AK242299 (DDBJ, Best hit)"	"P27777 (UniProt)"	"-"	"-"	"J075192I02"	"6161"	"AT1G53540.1"	"1"	"protein_coding"	"HSP20-like chaperones superfamily protein"	"NULL"	"\"HSP20-like chaperones superfamily protein; CONTAINS InterPro DOMAIN/s: Heat shock protein Hsp20 (InterPro:IPR002068), HSP20-like chaperone (InterPro:IPR008978); BEST Arabidopsis thaliana protein match is: heat shock protein 17.4 (TAIR:AT3G46230.1)\""	"-"	"HSP20-like chaperones superfamily protein"	"-"	"-"	"-"	"HSP20-like chaperones superfamily protein%3B CONTAINS InterPro DOMAIN/s: Heat shock protein Hsp20 (InterPro:IPR002068)%2C HSP20-like chaperone (InterPro:IPR008978)%3B BEST Arabidopsis thaliana protein match is: heat shock protein 17.4 (TAIR:AT3G46230.1)%3B Has 7090 Blast hits to 7089 proteins in 1610 species: Archae - 175%3B Bacteria - 4287%3B Metazoa - 66%3B Fungi - 302%3B Plants - 1606%3B Viruses - 0%3B Other Eukaryotes - 654 (source: NCBI BLink)."	"\"PMID:12169696,PMID:14500793,PMID:14964527,PMID:15047901,PMID:15200641,PMID:15381001,PMID:15546358,PMID:16021335,PMID:16081496,PMID:16258017,PMID:16531488,PMID:16623895,PMID:17061125,PMID:17059409,PMID:18212028,PMID:18441212,PMID:18805951,PMID:18775970,locus:2024862\""	"protein_coding"	"-"	"-"	"-"	"data"
0.56	"Os01t0834700-01"	"Os01g0834700"	"Zinc finger, CCCH-type domain containing protein."	"-"	"-"	"C3H11"	"ZINC FINGER CCCH DOMAIN-CONTAINING PROTEIN 11"	"OsC3H11"	"Zinc finger CCCH domain-containing protein 11"	"Molecular Function: nucleic acid binding (GO:0003676), Molecular Function: zinc ion binding (GO:0008270)"	"Zinc finger, CCCH-type (IPR000571)"	"AK106074 (DDBJ, Best hit), AK101559 (DDBJ, Best hit)"	"B6TD33 (UniProt)"	"-"	"-"	"001-206-H10, J033050C24"	"8574"	"AT2G20280.1"	"2"	"protein_coding"	"Zinc finger C-x8-C-x5-C-x3-H type family protein"	"NULL"	"\"Zinc finger C-x8-C-x5-C-x3-H type family protein; FUNCTIONS IN: zinc ion binding, nucleic acid binding; INVOLVED IN: biological_process unknown; LOCATED IN: cellular_component unknown; EXPRESSED IN: 22 plant structures; EXPRESSED DURING: 13 growth stages; CONTAINS InterPro DOMAIN/s: Zinc finger, CCCH-type (InterPro:IPR000571)\""	"-"	"Zinc finger C-x8-C-x5-C-x3-H type family protein"	"-"	"-"	"-"	"Zinc finger C-x8-C-x5-C-x3-H type family protein%3B FUNCTIONS IN: zinc ion binding%2C nucleic acid binding%3B INVOLVED IN: biological_process unknown%3B LOCATED IN: cellular_component unknown%3B EXPRESSED IN: 22 plant structures%3B EXPRESSED DURING: 13 growth stages%3B CONTAINS InterPro DOMAIN/s: Zinc finger%2C CCCH-type (InterPro:IPR000571)%3B Has 6263 Blast hits to 4194 proteins in 354 species: Archae - 14%3B Bacteria - 176%3B Metazoa - 2274%3B Fungi - 740%3B Plants - 301%3B Viruses - 209%3B Other Eukaryotes - 2549 (source: NCBI BLink)."	"\"PMID:18221561,PMID:18650403,locus:2039022\""	"protein_coding"	"-"	"-"	"-"	"data"
0.56	"Os02t0644100-01"	"Os02g0644100"	"Similar to Heat shock protein STI (Stress inducible protein) (GmSTI)."	"-"	"-"	"-"	"-"	"-"	"-"	"Molecular Function: binding (GO:0005488), Molecular Function: protein binding (GO:0005515)"	"Tetratricopeptide TPR-1 (IPR001440), Heat shock chaperonin-binding (IPR006636), Tetratricopeptide-like helical (IPR011990), Tetratricopeptide repeat-containing (IPR013026), Tetratricopeptide TPR2 (IPR013105), Tetratricopeptide repeat (IPR019734)"	"AK102431 (DDBJ, Best hit)"	"Q43468 (UniProt)"	"-"	"-"	"J033093H17"	"-"	"AT1G62740.1"	"2"	"protein_coding"	"\"stress-inducible protein, putative\""	"\"Encodes one of the 36 carboxylate clamp (CC)-tetratricopeptide repeat (TPR) proteins (Prasad 2010, Pubmed ID: 20856808) with potential to interact with Hsp90/Hsp70 as co-chaperones. The mRNA is cell-to-cell mobile.\""	"\"stress-inducible protein, putative; FUNCTIONS IN: binding; INVOLVED IN: response to cadmium ion, response to stress; LOCATED IN: cytosol, nucleus, plasma membrane; EXPRESSED IN: 25 plant structures; EXPRESSED DURING: 14 growth stages; CONTAINS InterPro DOMAIN/s: Heat shock chaperonin-binding (InterPro:IPR006636), Tetratricopeptide TPR-1 (InterPro:IPR001440), Tetratricopeptide-like helical (InterPro:IPR011990), Tetratricopeptide repeat-containing (InterPro:IPR013026), Tetratricopeptide repeat (InterPro:IPR019734); BEST Arabidopsis thaliana protein match is: stress-inducible protein, putative (TAIR:AT1G12270.1)\""	"Hop2"	"stress-inducible protein"	"Hop2"	"-"	"Hop2"	"stress-inducible protein%2C putative%3B FUNCTIONS IN: binding%3B INVOLVED IN: response to cadmium ion%2C response to stress%3B LOCATED IN: cytosol%2C nucleus%2C plasma membrane%3B EXPRESSED IN: 25 plant structures%3B EXPRESSED DURING: 14 growth stages%3B CONTAINS InterPro DOMAIN/s: Heat shock chaperonin-binding (InterPro:IPR006636)%2C Tetratricopeptide TPR-1 (InterPro:IPR001440)%2C Tetratricopeptide-like helical (InterPro:IPR011990)%2C Tetratricopeptide repeat-containing (InterPro:IPR013026)%2C Tetratricopeptide repeat (InterPro:IPR019734)%3B BEST Arabidopsis thaliana protein match is: stress-inducible protein%2C putative (TAIR:AT1G12270.1)%3B Has 44605 Blast hits to 18649 proteins in 1479 species: Archae - 1696%3B Bacteria - 14533%3B Metazoa - 9820%3B Fungi - 2891%3B Plants - 3854%3B Viruses - 4%3B Other Eukaryotes - 11807 (source: NCBI BLink)."	"\"PMID:12777046,PMID:18182375,PMID:18433157,PMID:18650403,PMID:18784283,PMID:20005002,PMID:20118269,PMID:20736450,PMID:20856808,PMID:21596689,locus:2026197\""	"protein_coding"	"Encodes one of the 36 carboxylate clamp (CC)-tetratricopeptide repeat (TPR) proteins (Prasad 2010%2C Pubmed ID: 20856808) with potential to interact with Hsp90/Hsp70 as co-chaperones."	"-"	"-"	"data"
0.56	"Os02t0117200-01"	"Os02g0117200"	"Similar to MIR-interacting saposin-like protein."	"-"	"-"	"-"	"-"	"-"	"-"	"-"	"Protein of unknown function DUF3456 (IPR021852)"	"AK241361 (DDBJ, Best hit)"	"B6T6D7 (UniProt)"	"-"	"-"	"J065151F22"	"-"	"AT1G42480.1"	"2"	"protein_coding"	"NULL"	"NULL"	"unknown protein; FUNCTIONS IN: molecular_function unknown; INVOLVED IN: biological_process unknown; LOCATED IN: endomembrane system; EXPRESSED IN: 24 plant structures; EXPRESSED DURING: 13 growth stages; CONTAINS InterPro DOMAIN/s: Protein of unknown function DUF3456 (InterPro:IPR021852)"	"-"	"TLR4 regulator/MIR-interacting MSAP protein"	"-"	"-"	"-"	"unknown protein%3B FUNCTIONS IN: molecular_function unknown%3B INVOLVED IN: biological_process unknown%3B LOCATED IN: endomembrane system%3B EXPRESSED IN: 24 plant structures%3B EXPRESSED DURING: 13 growth stages%3B CONTAINS InterPro DOMAIN/s: Protein of unknown function DUF3456 (InterPro:IPR021852)%3B Has 177 Blast hits to 177 proteins in 59 species: Archae - 0%3B Bacteria - 0%3B Metazoa - 140%3B Fungi - 0%3B Plants - 35%3B Viruses - 0%3B Other Eukaryotes - 2 (source: NCBI BLink)."	"\"PMID:12093376,PMID:18775970,PMID:20226671,locus:2206100\""	"protein_coding"	"-"	"-"	"-"	"data"
0.56	"Os05t0364600-01"	"Os05g0364600"	"Similar to pre-mRNA-splicing factor SF2."	"-"	"-"	"-"	"-"	"-"	"-"	"Molecular Function: nucleotide binding (GO:0000166), Molecular Function: nucleic acid binding (GO:0003676)"	"RNA recognition motif domain (IPR000504), Nucleotide-binding, alpha-beta plait (IPR012677)"	"AK071503 (DDBJ, Best hit)"	"NP_001150424.1 (RefSeq)"	"-"	"-"	"J023091N08"	"-"	"AT1G09140.3"	"2"	"protein_coding"	"SERINE-ARGININE PROTEIN 30"	"\"Encodes a serine-arginine rich RNA binding protein involved in regulation of splicing (including splicing of itself). Exists as 3 alternative spliced forms that are differentially expressed. Barta et al (2010) have proposed a nomenclature for Serine/Arginine-Rich Protein Splicing Factors (SR proteins): Plant Cell. 2010, 22:2926.\""	"\"SERINE-ARGININE PROTEIN 30 (ATSRP30); CONTAINS InterPro DOMAIN/s: RNA recognition motif, RNP-1 (InterPro:IPR000504), Nucleotide-binding, alpha-beta plait (InterPro:IPR012677); BEST Arabidopsis thaliana protein match is: RNA-binding (RRM/RBD/RNP motifs) family protein (TAIR:AT1G02840.3)\""	"\"At-SR30,ATSRP30,ATSRP30.1,ATSRP30.2,SR30\""	"SERINE-ARGININE PROTEIN 30"	"SR30"	"\"ATSRP30.1,ATSRP30.2,ATSRP30,SERINE-ARGININE PROTEIN 30,At-SR30,Serine/Arginine-Rich Protein Splicing Factor 30\""	"Serine/Arginine-Rich Protein Splicing Factor 30"	"SERINE-ARGININE PROTEIN 30 (ATSRP30)%3B CONTAINS InterPro DOMAIN/s: RNA recognition motif%2C RNP-1 (InterPro:IPR000504)%2C Nucleotide-binding%2C alpha-beta plait (InterPro:IPR012677)%3B BEST Arabidopsis thaliana protein match is: RNA-binding (RRM/RBD/RNP motifs) family protein (TAIR:AT1G02840.3)%3B Has 10547 Blast hits to 8837 proteins in 431 species: Archae - 0%3B Bacteria - 274%3B Metazoa - 6368%3B Fungi - 1180%3B Plants - 1529%3B Viruses - 86%3B Other Eukaryotes - 1110 (source: NCBI BLink)."	"\"PMID:10215626,PMID:15034145,PMID:15047901,PMID:15270675,PMID:15452276,PMID:16520337,PMID:16839183,PMID:17556373,PMID:18650403,PMID:18775970,PMID:20736450,PMID:20884799,PMID:21935421,PMID:23132568,PMID:22563826,locus:2195346\""	"protein_coding"	"Encodes a serine-arginine rich RNA binding protein involved in regulation of splicing (including splicing of itself). Exists as 3 alternative spliced forms that are differentially expressed. Barta et al (2010) have proposed a nomenclature for Serine/Arginine-Rich Protein Splicing Factors (SR proteins): Plant Cell. 2010%2C 22:2926."	"-"	"-"	"data"
0.56	"Os04t0521700-01"	"Os04g0521700"	"Similar to OSIGBa0131L05.9 protein."	"-"	"-"	"-"	"-"	"-"	"-"	"-"	"-"	"AK073622 (DDBJ, Best hit)"	"Q01IB2 (UniProt)"	"-"	"-"	"J033049O03"	"-"	"-"	"-"	"-"	"-"	"-"	"-"	"-"	"-"	"-"	"-"	"-"	"-"	"-"	"-"	"-"	"-"	"-"	"data"
0.57	"Os04t0576800-01"	"Os04g0576800"	"Similar to predicted protein."	"-"	"-"	"-"	"-"	"-"	"-"	"Biological Process: lipid metabolic process (GO:0006629), Cellular Component: cytoplasm (GO:0005737), Cellular Component: integral to membrane (GO:0016021), Molecular Function: oxidoreductase activity, acting on the CH-CH group of donors (GO:0016627)"	"3-oxo-5-alpha-steroid 4-dehydrogenase, C-terminal (IPR001104)"	"AK099759 (DDBJ, Best hit)"	"XP_002872763.1 (RefSeq)"	"-"	"-"	"J013093L13"	"-"	"AT1G72590.1"	"2"	"protein_coding"	"3-oxo-5-alpha-steroid 4-dehydrogenase family protein"	"Encodes a polyphenol reductase."	"\"3-oxo-5-alpha-steroid 4-dehydrogenase family protein; FUNCTIONS IN: oxidoreductase activity, acting on the CH-CH group of donors, 3-oxo-5-alpha-steroid 4-dehydrogenase activity; INVOLVED IN: lipid metabolic process; LOCATED IN: endomembrane system, integral to membrane, cytoplasm; CONTAINS InterPro DOMAIN/s: 3-oxo-5-alpha-steroid 4-dehydrogenase, C-terminal (InterPro:IPR001104); BEST Arabidopsis thaliana protein match is: 3-oxo-5-alpha-steroid 4-dehydrogenase family protein (TAIR:AT2G16530.1)\""	"PPRD1"	"3-oxo-5-alpha-steroid 4-dehydrogenase family protein"	"-"	"-"	"-"	"3-oxo-5-alpha-steroid 4-dehydrogenase family protein%3B FUNCTIONS IN: oxidoreductase activity%2C acting on the CH-CH group of donors%2C 3-oxo-5-alpha-steroid 4-dehydrogenase activity%3B INVOLVED IN: lipid metabolic process%3B LOCATED IN: endomembrane system%2C integral to membrane%2C cytoplasm%3B CONTAINS InterPro DOMAIN/s: 3-oxo-5-alpha-steroid 4-dehydrogenase%2C C-terminal (InterPro:IPR001104)%3B BEST Arabidopsis thaliana protein match is: 3-oxo-5-alpha-steroid 4-dehydrogenase family protein (TAIR:AT2G16530.1)%3B Has 1090 Blast hits to 1086 proteins in 214 species: Archae - 0%3B Bacteria - 21%3B Metazoa - 397%3B Fungi - 195%3B Plants - 181%3B Viruses - 0%3B Other Eukaryotes - 296 (source: NCBI BLink)."	"\"PMID:15295017,PMID:15914083,PMID:21558543,locus:2030235\""	"protein_coding"	"-"	"-"	"-"	"data"
0.57	"Os08t0366100-01"	"Os08g0366100"	"Similar to Endothelial differentiation-related factor 1 (EDF-1) (Multiprotein bridging factor 1) (MBF1)."	"-"	"-"	"-"	"-"	"Edf"	"MBF1 transcription factor, Endothelial differentiation factor"	"Molecular Function: DNA binding (GO:0003677), Molecular Function: sequence-specific DNA binding (GO:0043565)"	"Helix-turn-helix type 3 (IPR001387), Lambda repressor-like, DNA-binding (IPR010982), Multiprotein bridging factor 1, N-terminal (IPR013729)"	"AK120339 (DDBJ, Best hit), AK061882 (DDBJ, Best hit)"	"F1DK64 (UniProt)"	"-"	"-"	"J013060M10, 001-041-F01"	"16189"	"AT2G42680.1"	"2"	"protein_coding"	"multiprotein bridging factor 1A"	"\"One of three genes in A. thaliana encoding multiprotein bridging factor 1, a highly conserved transcriptional coactivator.  May serve as a bridging factor between a bZIP factor and TBP.  Its expression is developmentally regulated. The mRNA is cell-to-cell mobile.\""	"\"multiprotein bridging factor 1A (MBF1A); CONTAINS InterPro DOMAIN/s: Lambda repressor-like, DNA-binding (InterPro:IPR010982), Multiprotein bridging factor 1, N-terminal (InterPro:IPR013729), Helix-turn-helix type 3 (InterPro:IPR001387); BEST Arabidopsis thaliana protein match is: multiprotein bridging factor 1B (TAIR:AT3G58680.1)\""	"\"ATMBF1A,MBF1A\""	"multiprotein bridging factor 1A"	"MBF1A"	"\"ATMBF1A,ARABIDOPSIS THALIANA MULTIPROTEIN BRIDGING FACTOR 1A\""	"multiprotein bridging factor 1A"	"multiprotein bridging factor 1A (MBF1A)%3B CONTAINS InterPro DOMAIN/s: Lambda repressor-like%2C DNA-binding (InterPro:IPR010982)%2C Multiprotein bridging factor 1%2C N-terminal (InterPro:IPR013729)%2C Helix-turn-helix type 3 (InterPro:IPR001387)%3B BEST Arabidopsis thaliana protein match is: multiprotein bridging factor 1B (TAIR:AT3G58680.1)%3B Has 672 Blast hits to 672 proteins in 252 species: Archae - 42%3B Bacteria - 8%3B Metazoa - 193%3B Fungi - 147%3B Plants - 135%3B Viruses - 2%3B Other Eukaryotes - 145 (source: NCBI BLink)."	"\"PMID:12969430,PMID:14988493,PMID:15451167,PMID:16244138,PMID:16283071,PMID:18201973,PMID:18650403,PMID:18775970,PMID:19050034,PMID:19783066,locus:2041509\""	"protein_coding"	"One of three genes in A. thaliana encoding multiprotein bridging factor 1%2C a highly conserved transcriptional coactivator.  May serve as a bridging factor between a bZIP factor and TBP.  Its expression is developmentally regulated."	"-"	"-"	"data"
0.57	"Os05t0435400-01"	"Os05g0435400"	"Conserved hypothetical protein."	"-"	"-"	"-"	"-"	"-"	"-"	"-"	"-"	"AK109595 (DDBJ, Best hit)"	"A3A6X8 (UniProt)"	"-"	"-"	"002-137-D03"	"-"	"-"	"-"	"-"	"-"	"-"	"-"	"-"	"-"	"-"	"-"	"-"	"-"	"-"	"-"	"-"	"-"	"-"	"data"
0.57	"Os01t0316600-01"	"Os01g0316600"	"Similar to pre-mRNA-splicing factor SF2."	"-"	"-"	"-"	"-"	"-"	"-"	"Molecular Function: nucleotide binding (GO:0000166), Molecular Function: nucleic acid binding (GO:0003676)"	"RNA recognition motif domain (IPR000504), Nucleotide-binding, alpha-beta plait (IPR012677)"	"AK103534 (DDBJ, Best hit)"	"NP_001150424.1 (RefSeq)"	"-"	"-"	"J033132A12"	"-"	"AT1G09140.3"	"1"	"protein_coding"	"SERINE-ARGININE PROTEIN 30"	"\"Encodes a serine-arginine rich RNA binding protein involved in regulation of splicing (including splicing of itself). Exists as 3 alternative spliced forms that are differentially expressed. Barta et al (2010) have proposed a nomenclature for Serine/Arginine-Rich Protein Splicing Factors (SR proteins): Plant Cell. 2010, 22:2926.\""	"\"SERINE-ARGININE PROTEIN 30 (ATSRP30); CONTAINS InterPro DOMAIN/s: RNA recognition motif, RNP-1 (InterPro:IPR000504), Nucleotide-binding, alpha-beta plait (InterPro:IPR012677); BEST Arabidopsis thaliana protein match is: RNA-binding (RRM/RBD/RNP motifs) family protein (TAIR:AT1G02840.3)\""	"\"At-SR30,ATSRP30,ATSRP30.1,ATSRP30.2,SR30\""	"SERINE-ARGININE PROTEIN 30"	"SR30"	"\"ATSRP30.1,ATSRP30.2,ATSRP30,SERINE-ARGININE PROTEIN 30,At-SR30,Serine/Arginine-Rich Protein Splicing Factor 30\""	"Serine/Arginine-Rich Protein Splicing Factor 30"	"SERINE-ARGININE PROTEIN 30 (ATSRP30)%3B CONTAINS InterPro DOMAIN/s: RNA recognition motif%2C RNP-1 (InterPro:IPR000504)%2C Nucleotide-binding%2C alpha-beta plait (InterPro:IPR012677)%3B BEST Arabidopsis thaliana protein match is: RNA-binding (RRM/RBD/RNP motifs) family protein (TAIR:AT1G02840.3)%3B Has 10547 Blast hits to 8837 proteins in 431 species: Archae - 0%3B Bacteria - 274%3B Metazoa - 6368%3B Fungi - 1180%3B Plants - 1529%3B Viruses - 86%3B Other Eukaryotes - 1110 (source: NCBI BLink)."	"\"PMID:10215626,PMID:15034145,PMID:15047901,PMID:15270675,PMID:15452276,PMID:16520337,PMID:16839183,PMID:17556373,PMID:18650403,PMID:18775970,PMID:20736450,PMID:20884799,PMID:21935421,PMID:23132568,PMID:22563826,locus:2195346\""	"protein_coding"	"Encodes a serine-arginine rich RNA binding protein involved in regulation of splicing (including splicing of itself). Exists as 3 alternative spliced forms that are differentially expressed. Barta et al (2010) have proposed a nomenclature for Serine/Arginine-Rich Protein Splicing Factors (SR proteins): Plant Cell. 2010%2C 22:2926."	"-"	"-"	"data"
